{
  "schema_version": 1,
  "issue": 107,
  "date": "2026-08-11",
  "spec": {
    "agent_plugins_version": "1.0.0",
    "agent_plugins_schema": "https://agent-plugins.org/schemas/1.0.0/plugin.schema.json"
  },
  "source_run": {
    "candidate_commit": "PENDING_CLEAN_RERUN",
    "canonical_fingerprint": "98a49a9a3efa807363d3f4411f01f15992642fd1f4224fa8d8a57de2aa0e4ffb",
    "package_version": "0.13.0",
    "plugin_manifest_sha256": "0000000000000000000000000000000000000000000000000000000000000000",
    "bundle_lock_sha256": "PENDING"
  },
  "environment": {
    "apm_version": "PENDING",
    "copilot_cli_version": "PENDING"
  },
  "bundle": {
    "status": "PASS",
    "manifest_conformance": "PASS",
    "canonical_skill_match": true,
    "canonical_agent_match": true
  },
  "copilot_direct_load": {
    "status": "NOT_RUN",
    "plugin_discovery": "NOT_RUN",
    "authorization": "NOT_RUN",
    "standard_slice": "NOT_RUN",
    "full_coverage": "NOT_RUN",
    "adaptive_connection": "NOT_RUN",
    "capability_gaps": [
      "Placeholder until clean-commit external-model re-run after review fixes"
    ]
  },
  "codex_direct_load": {
    "status": "NOT_TESTED",
    "evidence": []
  },
  "boundary_inventory": [
    {
      "item": "Plan Coverage SKILL.md",
      "classification": "agent-plugins-portable"
    },
    {
      "item": "Skill references",
      "classification": "agent-plugins-portable"
    },
    {
      "item": "Plan Coverage custom agents",
      "classification": "copilot-plugin-extension"
    },
    {
      "item": "Plan Coverage shared instruction",
      "classification": "apm-projection-materialization"
    },
    {
      "item": "Adaptive Implementation Skill",
      "classification": "transitive-portable-dependency"
    },
    {
      "item": "Adaptive HIGH agent",
      "classification": "copilot-plugin-extension"
    },
    {
      "item": "Adaptive STANDARD agent",
      "classification": "copilot-plugin-extension"
    },
    {
      "item": "APM lock/provenance",
      "classification": "apm-distribution-provenance"
    },
    {
      "item": "Codex TOML projection",
      "classification": "codex-runtime-adapter"
    },
    {
      "item": "explicit invocation authorization",
      "classification": "agent-plugins-portable"
    },
    {
      "item": "concrete model selection",
      "classification": "codex-runtime-adapter"
    },
    {
      "item": "handoff state",
      "classification": "currently-unqualified"
    },
    {
      "item": "Copilot runtime custom agents",
      "classification": "copilot-runtime-adapter"
    }
  ],
  "comparison_to_apm": {
    "baseline_canonical_fingerprint": "98a49a9a3efa807363d3f4411f01f15992642fd1f4224fa8d8a57de2aa0e4ffb",
    "current_canonical_fingerprint": "98a49a9a3efa807363d3f4411f01f15992642fd1f4224fa8d8a57de2aa0e4ffb",
    "fingerprint_match": true,
    "semantic_parity_claimed": false
  },
  "scenarios": [],
  "decision": {
    "verdict": "HOLD",
    "rationale": [
      "Placeholder result; replace with clean-commit direct-load evidence after review fixes land."
    ],
    "next_steps": [
      "Commit review fixes cleanly",
      "Re-run run-plan-coverage-copilot-plugin-poc.ps1 -ConfirmExternalModelPayload"
    ]
  }
}